{"$schema":"../../../schema/project-manifest.schema.json","schemaVersion":1,"id":"litheview.project.synthetic-red-staging-smoke","displayName":"synthetic packed display Red Subpixel Contract Smoke Test","schemaCompatibility":{"displaySurface":1,"projectManifest":1,"form":1,"resourceManifest":1,"extensionManifest":1},"surfaceProfile":{"id":"litheview.surface.synthetic-red-staging","sha256":"df421d1ebe0efca1f053d3a5bb3321f753c4c4cea7bc8f5681643bf88e93b522"},"forms":[],"resourceManifests":[],"extensions":[]}