{"$schema":"https://litheview.dev/schema/project-manifest.schema.json","schemaVersion":3,"id":"litheview.project.native-synthetic-r2-smoke","displayName":"Native synthetic packed display Red Smoke","schemaCompatibility":{"projectManifest":3,"displayDefinition":2,"logicalInput":1,"form":1,"resourceManifest":1,"extensionManifest":1},"displayDefinition":{"id":"litheview.definition.software.synthetic-r2","sha256":"b47468cd65f225798e8201b00d61a4f38b48b95d1f1a14fd431ffdfae2b9e82b"},"logicalInput":{"id":"litheview.input.encoder-select","sha256":"0ecb37f0edce92aa88ce04bba079724633591c02b1f6ff14390f5152e373faa5"},"forms":["forms/main.litheview.xml"],"resourceManifests":[],"extensions":[]}