{
  "$schema": "https://litheview.dev/schema/project-manifest.schema.json",
  "schemaVersion": 2,
  "id": "litheview.project.h750.sdr",
  "displayName": "H750 SDR Display",
  "schemaCompatibility": {
    "displaySurface": 1,
    "projectManifest": 2,
    "displayDefinition": 2,
    "logicalInput": 1,
    "form": 1,
    "resourceManifest": 1,
    "extensionManifest": 1
  },
  "surfaceProfile": {
    "id": "litheview.menu.h750.surface",
    "sha256": "1f34f8bf73c076cb9f7992ba75664de12b8b19325a2e2c9c15a3130001e154e7"
  },
  "displayDefinition": {
    "id": "litheview.menu.h750.surface",
    "sha256": "090a0326cd60197f4930d865154a04d962465855797a85428ef32ed12a9f2303"
  },
  "logicalInput": {
    "id": "litheview.input.menu",
    "sha256": "e4ccff1999985019cb1b6359221ab27f1804d6e417457e28df51d6a7708c9f3c"
  },
  "forms": ["forms/Sdr.litheview.xml"],
  "resourceManifests": [],
  "extensions": []
}
