{"$schema":"https://litheview.dev/schema/project-manifest.schema.json","schemaVersion":2,"id":"litheview.project.first-display","displayName":"First Display","schemaCompatibility":{"displaySurface":1,"projectManifest":2,"displayDefinition":2,"logicalInput":1,"form":1,"resourceManifest":1,"extensionManifest":1},"surfaceProfile":{"id":"litheview.project.first-display.surface","sha256":"75effc2266ffe2d16b2e20a8977e75add6b2630fc240b78386777f060f12bbc4"},"displayDefinition":{"id":"litheview.project.first-display.surface","sha256":"c3840d1da24c0b8963a458a09fa37176f6514b1ced3c75acb00a55f5eb64ac6b"},"logicalInput":{"id":"litheview.input.touch","sha256":"5c721bc595275afd87426ffb69c077bfbd4f29d09315df07dd19699b43800e4d"},"forms":["forms/main.litheview.xml"],"resourceManifests":[],"extensions":[]}
