{"$schema":"../../../schema/project-manifest.schema.json","schemaVersion":1,"id":"litheview.project.synthetic-red-yellow-smoke","displayName":"synthetic packed display Red/Yellow Contract Smoke Test","schemaCompatibility":{"displaySurface":1,"projectManifest":1,"form":1,"resourceManifest":1,"extensionManifest":1},"surfaceProfile":{"id":"litheview.surface.synthetic-red-yellow-staging","sha256":"47be848df113c2c0d1c01c525864f5a5433738e35d7abb42c0d94866fd1af9ca"},"forms":[],"resourceManifests":[],"extensions":[]}